[
  {
    "id": "machine-payments-protocol-mpp",
    "name": "Machine Payments Protocol (MPP)",
    "url": "https://mpp.dev",
    "repo": "https://github.com/wevm/mppx",
    "category": "payment-protocols",
    "chain": "multi",
    "description": "HTTP 402 protocol co-developed by Tempo and Stripe for charging API requests, tool calls and content.",
    "status": "active",
    "pricing": "free",
    "added": "2026-10-10"
  },
  {
    "id": "nevermined",
    "name": "Nevermined",
    "url": "https://nevermined.ai",
    "repo": "https://github.com/nevermined-io/payments",
    "category": "payment-protocols",
    "chain": "multi",
    "description": "Payments infrastructure for AI agents covering delegated spending, usage metering and settlement across MCP, x402 and A2A.",
    "status": "active",
    "pricing": "unknown",
    "added": "2026-10-10"
  },
  {
    "id": "payai",
    "name": "PayAI",
    "url": "https://payai.network",
    "repo": null,
    "category": "payment-protocols",
    "chain": "multi",
    "description": "x402 payment facilitator for agents and apps that settles stablecoin payments across supported Solana and EVM networks.",
    "status": "active",
    "pricing": "unknown",
    "added": "2026-10-10"
  },
  {
    "id": "stripe-machine-payments",
    "name": "Stripe Machine Payments",
    "url": "https://docs.stripe.com/payments/machine",
    "repo": null,
    "category": "payment-protocols",
    "chain": "none",
    "description": "Stripe documentation for accepting machine-to-machine and agent payments for APIs and services.",
    "status": "active",
    "pricing": "paid",
    "added": "2026-10-10"
  },
  {
    "id": "x402",
    "name": "x402",
    "url": "https://x402.org",
    "repo": "https://github.com/coinbase/x402",
    "category": "payment-protocols",
    "chain": "multi",
    "description": "Open payments protocol built on HTTP 402 that lets clients pay for API calls with stablecoins, with Solana and EVM support.",
    "status": "active",
    "pricing": "free",
    "added": "2026-10-10"
  },
  {
    "id": "402-index",
    "name": "402 Index",
    "url": "https://402index.io",
    "repo": null,
    "category": "service-discovery",
    "chain": "multi",
    "description": "Protocol-agnostic directory of paid APIs (L402, x402, MPP) for AI agents, indexed, verified and searchable.",
    "status": "active",
    "pricing": "free",
    "added": "2026-10-10"
  },
  {
    "id": "orthogonal",
    "name": "Orthogonal",
    "url": "https://www.orthogonal.com",
    "repo": null,
    "category": "service-discovery",
    "chain": "none",
    "description": "One account for agents to reach web search, scraping and enrichment APIs through a unified API, MCP server or CLI, paying per call.",
    "status": "active",
    "pricing": "pay-per-call",
    "added": "2026-10-10"
  },
  {
    "id": "x402-bazaar",
    "name": "x402 Bazaar",
    "url": "https://docs.cdp.coinbase.com/x402/bazaar",
    "repo": null,
    "category": "service-discovery",
    "chain": "multi",
    "description": "Coinbase Developer Platform discovery layer where buyers and agents find x402-enabled services.",
    "status": "active",
    "pricing": "free",
    "added": "2026-10-10"
  },
  {
    "id": "x402scan",
    "name": "x402scan",
    "url": "https://www.x402scan.com",
    "repo": null,
    "category": "service-discovery",
    "chain": "multi",
    "description": "Explorer for the x402 ecosystem showing transactions, sellers, origins and resources.",
    "status": "active",
    "pricing": "free",
    "added": "2026-10-10"
  },
  {
    "id": "birdeye-data",
    "name": "Birdeye Data",
    "url": "https://docs.birdeye.so",
    "repo": null,
    "category": "solana-data",
    "chain": "multi",
    "description": "Token, price and wallet data API with strong Solana coverage.",
    "status": "active",
    "pricing": "freemium",
    "added": "2026-10-10"
  },
  {
    "id": "helius",
    "name": "Helius",
    "url": "https://www.helius.dev",
    "repo": null,
    "category": "solana-data",
    "chain": "solana",
    "description": "Solana RPC, APIs, gRPC, webhooks and dedicated infrastructure, with a documented path for agents.",
    "status": "active",
    "pricing": "freemium",
    "added": "2026-10-10"
  },
  {
    "id": "hello-moon",
    "name": "Hello Moon",
    "url": "https://www.hellomoon.io",
    "repo": null,
    "category": "solana-data",
    "chain": "solana",
    "description": "Transaction landing, staking and data infrastructure for Solana teams.",
    "status": "active",
    "pricing": "unknown",
    "added": "2026-10-10"
  },
  {
    "id": "jupiter-developer-platform",
    "name": "Jupiter Developer Platform",
    "url": "https://dev.jup.ag",
    "repo": null,
    "category": "solana-data",
    "chain": "solana",
    "description": "Developer platform for Jupiter APIs on Solana covering swaps, token data and prices.",
    "status": "active",
    "pricing": "freemium",
    "added": "2026-10-10"
  },
  {
    "id": "pumpportal",
    "name": "PumpPortal",
    "url": "https://pumpportal.fun",
    "repo": null,
    "category": "solana-data",
    "chain": "solana",
    "description": "Third-party API for Pump.fun and Raydium with low-latency data streams and transaction building.",
    "status": "active",
    "pricing": "unknown",
    "added": "2026-10-10"
  },
  {
    "id": "quicknode",
    "name": "Quicknode",
    "url": "https://www.quicknode.com",
    "repo": null,
    "category": "solana-data",
    "chain": "multi",
    "description": "Blockchain development platform offering RPC and data APIs, with documentation for building with AI.",
    "status": "active",
    "pricing": "freemium",
    "added": "2026-10-10"
  },
  {
    "id": "shyft",
    "name": "Shyft",
    "url": "https://shyft.to",
    "repo": null,
    "category": "solana-data",
    "chain": "solana",
    "description": "Solana gRPC streaming and staked RPC services for builders and traders.",
    "status": "active",
    "pricing": "freemium",
    "added": "2026-10-10"
  },
  {
    "id": "solana-tracker",
    "name": "Solana Tracker",
    "url": "https://www.solanatracker.io",
    "repo": null,
    "category": "solana-data",
    "chain": "solana",
    "description": "Solana data API with 70+ endpoints and WebSocket streams, plus dedicated RPC nodes.",
    "status": "active",
    "pricing": "freemium",
    "added": "2026-10-10"
  },
  {
    "id": "syndica",
    "name": "Syndica",
    "url": "https://www.syndica.io",
    "repo": null,
    "category": "solana-data",
    "chain": "solana",
    "description": "Blockchain infrastructure provider with Solana RPC and streaming services.",
    "status": "active",
    "pricing": "freemium",
    "added": "2026-10-10"
  },
  {
    "id": "triton-one",
    "name": "Triton One",
    "url": "https://triton.one",
    "repo": null,
    "category": "solana-data",
    "chain": "solana",
    "description": "Solana RPC, validator and data infrastructure provider.",
    "status": "active",
    "pricing": "paid",
    "added": "2026-10-10"
  },
  {
    "id": "vybe-network",
    "name": "Vybe Network",
    "url": "https://vybe.fyi",
    "repo": null,
    "category": "solana-data",
    "chain": "solana",
    "description": "Solana ecosystem metrics API covering DeFi TVL, whale transactions, active wallets and network activity.",
    "status": "active",
    "pricing": "freemium",
    "added": "2026-10-10"
  },
  {
    "id": "alchemy",
    "name": "Alchemy",
    "url": "https://www.alchemy.com",
    "repo": null,
    "category": "onchain-data",
    "chain": "multi",
    "description": "Blockchain infrastructure with node and data APIs across many chains, including Solana.",
    "status": "active",
    "pricing": "freemium",
    "added": "2026-10-10"
  },
  {
    "id": "allium",
    "name": "Allium",
    "url": "https://www.allium.so",
    "repo": null,
    "category": "onchain-data",
    "chain": "multi",
    "description": "Enterprise blockchain data platform with historical and real-time data across thousands of protocols.",
    "status": "active",
    "pricing": "paid",
    "added": "2026-10-10"
  },
  {
    "id": "bitquery",
    "name": "Bitquery",
    "url": "https://bitquery.io",
    "repo": null,
    "category": "onchain-data",
    "chain": "multi",
    "description": "Blockchain data APIs and real-time streams for 40+ chains including Solana gRPC, DEX trades and OHLCV.",
    "status": "active",
    "pricing": "freemium",
    "added": "2026-10-10"
  },
  {
    "id": "chainstack",
    "name": "Chainstack",
    "url": "https://www.chainstack.com",
    "repo": null,
    "category": "onchain-data",
    "chain": "multi",
    "description": "Managed blockchain node and RPC infrastructure across many protocols.",
    "status": "active",
    "pricing": "freemium",
    "added": "2026-10-10"
  },
  {
    "id": "codex",
    "name": "Codex",
    "url": "https://www.codex.io",
    "repo": null,
    "category": "onchain-data",
    "chain": "multi",
    "description": "API for real-time digital asset prices, charts, holders and onchain analytics across major networks.",
    "status": "active",
    "pricing": "freemium",
    "added": "2026-10-10"
  },
  {
    "id": "dune",
    "name": "Dune",
    "url": "https://docs.dune.com",
    "repo": null,
    "category": "onchain-data",
    "chain": "multi",
    "description": "Onchain analytics platform with an API for querying and retrieving blockchain datasets.",
    "status": "active",
    "pricing": "freemium",
    "added": "2026-10-10"
  },
  {
    "id": "goldrush",
    "name": "GoldRush",
    "url": "https://goldrush.dev",
    "repo": null,
    "category": "onchain-data",
    "chain": "multi",
    "description": "Multichain data APIs for builders, traders and teams.",
    "status": "active",
    "pricing": "freemium",
    "added": "2026-10-10"
  },
  {
    "id": "mobula",
    "name": "Mobula",
    "url": "https://docs.mobula.io/introduction",
    "repo": null,
    "category": "onchain-data",